<?xml version="1.0" encoding="UTF-8"?>
<osnova:Korisnik xmlns:osnova="https://github.com/draganagrbic998/xml/osnova"
 xmlns:xsi="http://www.w3.org/2001/XMLSchema-instance"
 xsi:schemaLocation="https://github.com/draganagrbic998/xml/osnova file:/C:/Users/Dragana/Desktop/schema_upgrade/osnova.xsd">
    <osnova:email>draganaasd@gmail.com</osnova:email>
    <osnova:lozinka>$2a$10$aL2cRpbMvSsvTcIGxUoauO4RMefDmYtEEARsmKJpwJ7T585HfBsra</osnova:lozinka>
    <osnova:Gradjanin>
		<osnova:Osoba>
			<osnova:ime>Dragana</osnova:ime>
			<osnova:prezime>Grbic</osnova:prezime>
		</osnova:Osoba>
		<osnova:Adresa>
			<osnova:mesto>Novi Sad</osnova:mesto>
			<osnova:ulica>Lasla Gala</osnova:ulica>
			<osnova:broj>23</osnova:broj>
		</osnova:Adresa>
    </osnova:Gradjanin>
</osnova:Korisnik>
